{
    "title": "Structural organization and gene expression in hiPSC-derived cardiomyocytes",
    "name": "cellsystems",
    "publications": [
        {
            "title": "",
            "url": "",
            "citation": ""
        },
        {
            "title": "",
            "url": "",
            "citation": ""
        }
    ],
    "datasets": [
        "fish/dataset.json",
        "live/dataset.json"
    ]
}